"ND","Recruiting of Personnel and Initial Training","Recrutement et formation initiale du personnel","1,117,862,895","1,071,324,076","1,117,862,895","1,071,324,076","1,138,620,391"
"ND","Equipment Acquisition and Disposal","Acquisition et disposition d'équipement","2,779,774,682","2,381,603,599","2,779,774,682","2,381,603,599","2,254,696,176"
"ND","Maritime Readiness","Disponibilité opérationnelle de la Force maritime","2,164,322,797","2,297,719,989","2,164,322,797","2,297,719,989","2,380,704,842"
"ND","Land Readiness","Disponibilité opérationnelle de l'Armée de terre","3,350,735,070","3,626,298,845","3,350,735,070","3,626,298,845","3,624,785,831"
"ND","Aerospace Readiness","Disponibilité opérationnelle de la Force aérospatiale","1,781,696,158","1,908,490,606","1,781,696,158","1,908,490,606","1,938,240,004"
"ND","Joint and Common Readiness","Disponibilité opérationnelle commune et interarmées","2,187,920,012","2,337,399,100","2,187,920,012","2,337,399,100","2,325,389,660"
"ND","Situational Awareness","Connaissance de la situation","775,516,219","599,458,841","775,516,219","599,458,841","435,588,022"
"ND","Canadian Peace, Stability and Security","Paix, stabilité et sécurité au Canada","318,491,821","336,916,949","318,491,821","336,916,949","351,048,363"
"ND","Continental Peace, Stability and Security","Paix, stabilité et sécurité du continent","190,986,751","202,579,814","190,986,751","202,579,814","234,636,710"
"ND","International Peace, Stability and Security","Paix, stabilité et sécurité sur la scène internationale","2,312,846,365","1,980,673,043","2,312,846,365","1,980,673,043","1,199,828,298"
"ND","Defence Team Personnel Support","Soutien du personnel de l'Équipe de la Défense","906,016,400","1,002,922,888","906,016,400","1,002,922,888","1,656,689,502"
"ND","Canadian Identity","Identité canadienne","353,601,906","369,853,191","353,601,906","369,853,191","359,554,725"
"ND","Environmental Protection and Stewardship","Protection et gérance de l'environnement","122,477,544","126,245,744","122,477,544","126,245,744","108,006,213"
"ND","Non-Security Support","Soutiens non-reliés à la sécurité","6,478,718","17,316,541","6,478,718","17,316,541","2,158,916"
"ND","Internal Services","Services internes","1,129,637,146","1,078,557,780","1,129,637,146","1,078,557,780","1,009,627,845"
"NEB","Energy Regulation Program","Programme Réglementation de l'énergie","26,927,668","34,867,506","26,927,668","34,867,506","44,125,872"
"NEB","Energy Information Program","Programme Information sur l'énergie","6,291,731","8,259,354","6,291,731","8,259,354","5,974,560"
"NEB","Internal Services","Services internes","25,632,618","21,248,754","25,632,618","21,248,754","19,445,209"
"NFB","Audiovisual Production","Production audiovisuelle","44,893,115","42,432,645","44,893,115","42,432,645","41,897,936"
"NFB","Marine Atlantic Inc.","Fonds renouvelable","-475,902",0,"-475,902",0,0
"NFB","Accessibility and Audience Engagement","Accessibilité et interaction avec l'auditoire","14,506,684","16,225,507","14,506,684","16,225,507","19,209,203"
"NFB","Internal Services","Services internes","8,483,248","8,194,426","8,483,248","8,194,426","7,644,722"
"NGC","National Gallery of Canada","Musée des beaux-arts du Canada","51,102,120","49,586,146","51,102,120","49,586,146","48,830,762"
"NMST","National Museum of Science and Technology","Musée national des sciences et de la technologie","35,371,192","30,304,286","35,371,192","30,304,286","31,517,304"
"NPB","Conditional Release Decisions","Décisions relatives à la mise en liberté sous condition","33,779,976","38,243,876","33,779,976","38,243,876","35,653,808"
"NPB","Conditional Release Openness and Accountability","Application transparente et responsable du processus de mise en liberté sous condition","5,693,295","7,087,169","5,693,295","7,087,169","5,562,361"
"NPB","Pardon Decisions/Clemency Recommendations","Décisions relatives à la réhabilitation et recommandations concernant l'exercice de la prérogative royale de clémence","2,094,742","1,153,988","2,094,742","1,153,988","274,473"
"NPB","Internal Services","Services internes","4,426,835","5,703,398","4,426,835","5,703,398","5,021,148"
"NRC","Energy and Environmental Technologies","Énergie et technologies environnementales","36,468,634","30,012,196","36,468,634","30,012,196","27,520,191"
"NRC","National Science and Technology Infrastructure","Infrastructure nationale en science et en technologie","98,608,317","96,359,502","98,608,317","96,359,502","94,893,647"
"NRC","Scientific, Technical and Medical Information","Information scientifique, technique et médicale","33,587,466","18,132,910","33,587,466","18,132,910","16,545,265"
"NRC","Manufacturing Technologies","Technologies de fabrication","128,599,091","111,766,495","128,599,091","111,766,495","99,228,802"
"NRC","Information and Communications Technologies and Emerging Technologies","Technologies de l'information et des communications et technologies émergentes","77,191,489","69,121,818","77,191,489","69,121,818","52,646,923"
"NRC","Industrial Research Assistance","Aide à la recherche industrielle","286,152,655","146,311,268","286,152,655","146,311,268","244,628,683"
"NRC","Health and Life Science Technologies","Technologies en santé et en sciences de la vie","115,102,789","102,913,760","115,102,789","102,913,760","82,478,395"
"NRC","Internal Services","Services internes","127,587,951","123,885,633","127,587,951","123,885,633","186,863,006"
"NRTEE","Advisory Program on Environment and Economy Issues","Programme consultatif sur les enjeux environnementaux et économiques","3,362,375","3,661,802","3,362,375","3,661,802","2,655,386"
"NRTEE","Internal Services","Services internes","1,789,766","1,701,994","1,789,766","1,701,994","2,788,012"
"NR","Clean energy","Énergie propre","1,329,561,608","1,323,313,646","1,329,561,608","1,323,313,646",0
"NR","Ecosystem risk management","Gestion du risque lié aux écosystèmes","198,295,951","199,083,001","198,295,951","199,083,001",0
"NR","Adapting to a changing climate and hazard risk management","S'adapter au changement climatique et gestion du risque lié aux dangers","60,822,192","50,834,869","60,822,192","50,834,869",0
"NR","Natural Resource and Landmass Knowledge and Systems","Des connaissances sur les ressources naturelles et la masse continentale et les systèmes","95,524,071","87,235,443","95,524,071","87,235,443",0
"NR","Geomatics Canada Revolving Fund","Fonds renouvelable de Géomatique Canada","-253,414","444,250","-253,414","444,250",0
"NR","Economic Opportunities for natural resources","Possibilités économiques pour les ressources naturelles","2,351,960,559","1,439,492,489","2,351,960,559","1,439,492,489",0
"NR","Natural resource-based communities","Collectivités tributaires des ressources naturelles","12,683,531","23,288","12,683,531","23,288",0
"NR","Market Access and Diversification","Accès au marché et diversification",0,0,0,0,"55,420,361"
"NR","Innovation for New Products and Processes","Innovation menant à de nouveaux produits et processus",0,0,0,0,"93,948,144"
"NR","Investment In Natural Resource Sectors","Investissement dans les secteurs des ressources naturelles",0,0,0,0,"73,319,149"
"NR","Statutory Programs - Atlantic Offshore","Programmes législatifs - zones extracôtières de l'Atlantique",0,0,0,0,"684,964,769"
"NR","Energy-efficient Practices and Lower-carbon Energy Sources","Pratiques éconergétiques et sources d'énergie à plus faible émission de carbone",0,0,0,0,"342,424,547"
"NR","Technology Innovation","Innovation technologique",0,0,0,0,"152,200,348"
"NR","Responsible Natural Resource Management","Gestion responsable des ressources naturelles",0,0,0,0,"236,874,939"
"NR","Protection for Canadians and Natural Resources","Protection des Canadiens et des ressources naturelles",0,0,0,0,"55,604,146"
"NR","Landmass Information","Information sur la masse continentale",0,0,0,0,"90,961,341"
"NR","Internal Services","Services internes","308,434,470","251,745,617","308,434,470","251,745,617","181,093,220"
"NSERC","Fund Research in Strategic Areas","Financer la recherche dans des domaines stratégiques","108,140,590","107,684,981","108,140,590","107,684,981","101,374,639"
"NSERC","Support for Research Equipment and Major Resources","Appuyer l'achat d'appareils et l'accès aux ressources majeures de recherche","71,036,088","66,408,464","71,036,088","66,408,464","60,711,985"
"NSERC","Attract and Retain Faculty","Attirer et garder en poste des membres du corps enseignant","161,123,214","137,196,679","161,123,214","137,196,679","135,248,080"
"NSERC","Fund Basic Research","Financer la recherche fondamentale","369,060,980","357,534,312","369,060,980","357,534,312","369,797,993"
"NSERC","Fund University-Industry-Government Partnerships","Financer des partenariats universités-industrie-gouvernement","122,029,034","184,682,265","122,029,034","184,682,265","185,440,529"
"NSERC","Promote Science and Engineering","Promouvoir les sciences et le génie","11,933,640","5,218,158","11,933,640","5,218,158","5,114,986"
"NSERC","Support Commercialization","Appuyer la commercialisation","53,112,017","57,942,110","53,112,017","57,942,110","50,878,787"
"NSERC","Support Students and Fellows","Appuyer les étudiants et les boursiers","153,759,352","144,055,249","153,759,352","144,055,249","140,261,268"
"NSERC","Internal Services","Services internes","25,748,999","25,015,376","25,748,999","25,015,376","27,153,005"
"NPA","Oversee the planning and construction of the canadian portion of the Alaska highway gas pipeline","Surveiller la planification et la construction de la partie canadienne du projet de gazoduc de la route de l'Alaska","1,124,556","2,107,613","1,124,556","2,107,613","1,920,142"
"OICC","Provincial-Territorial Infrastructure Base Fund","Financement de base de l'infrastructure des provinces et des territoires","437,322,406","188,695,432","437,322,406","188,695,432","236,858,957"
"OICC","Gas Tax Fund","Fonds de la taxe sur l'essence","1,751,558,460","2,206,246,353","1,751,558,460","2,206,246,353","1,965,101,267"
"OICC","Building Canada Fund-Communities component","Fonds Chantiers Canada -- Volet Collectivités","224,278,306","213,883,528","224,278,306","213,883,528","185,562,310"
"OICC","Building Canada Fund - Major Infrastructure Component","Fonds Chantiers Canada -- Volet Grandes infrastructures","404,966,944","759,827,768","404,966,944","759,827,768","922,540,575"
"OICC","Green Infrastructure Fund","Fonds pour l'infrastructure verte","34,162,512","30,273,741","34,162,512","30,273,741","116,441,609"
"OICC","Canada Strategic Infrastructure Fund","Fonds canadien sur l'infrastructure stratégique","335,675,193","188,381,898","335,675,193","188,381,898","240,062,809"
"OICC","Municipal Rural Infrastructure Fund","Fonds sur l'infrastructure municipale rurale","146,274,267","88,043,032","146,274,267","88,043,032","35,917,298"
"OICC","Border Infrastructure Fund","Fonds sur l'infrastructure frontalière","67,783,158","35,041,544","67,783,158","35,041,544","7,508,396"
"OICC","Economic Analysis and Research","Analyse économique et recherche","1,051,353","3,143,090","1,051,353","3,143,090","502,999"
"OICC","Infrastructure Stimulus Fund","Fonds de stimulation de l'infrastructure","2,478,125,347","634,927,373","2,478,125,347","634,927,373","54,454"
"OICC","Building Canada Fund  Communities Component Top-Up","Fonds Chantiers Canada -- Volet Collectivités - ajout","303,562,134","136,121,760","303,562,134","136,121,760",0
"OICC","Support for the G8 Summit 2010","Appui pour le Sommet du G8 2010","4,570,786",0,"4,570,786",0,0
"OICC","National Trails Coalition","Coalition nationale sur les sentiers","101,248",0,"101,248",0,0
"OICC","Internal Services","Services internes","62,358,620","55,524,756","62,358,620","55,524,756","42,105,718"
"ORL","Registration of Lobbyists","Enregistrement des lobbyistes","1,082,143","1,037,644","1,082,143","1,037,644","1,124,001"
"ORL","Education and Research","Éducation et recherche","927,220","939,571","927,220","939,571","924,150"
"ORL","Reviews and investigations under the Lobbying Act and the Lobbyists' Code of Conduct","Examens et enquêtes en vertu de la Loi sur le lobbying et du Code de déontologie des lobbyistes","945,296","1,106,171","945,296","1,106,171","1,019,962"
"ORL","Internal Services","Services internes","1,731,275","1,778,204","1,731,275","1,778,204","1,677,201"
"OCOL","Linguistic Rights Protection","Protection des droits linguistiques","6,557,545","7,058,731","6,557,545","7,058,731","6,321,862"
"OCOL","Linguistic Duality Promotion","Promotion de la dualité linguistique","6,355,479","6,537,097","6,355,479","6,537,097","6,494,480"
"OCOL","Internal Services","Services internes","8,564,710","8,759,208","8,564,710","8,759,208","8,317,674"
"OCSEC","The Communications Security Establishment Canada review program","Programme d'examen du Centre de la sécurité des télécommunications Canada","1,144,182","1,052,044","1,144,182","1,052,044","1,662,369"
"OCSEC","Internal Services","Services internes","461,777","890,384","461,777","890,384","623,350"
"OEC","Administration of the Conflict of Interest Act and the Conflict of Interest Code for Members of the House of Commons","Application de la Loi sur les conflits d'intérêts et du Code régissant les conflits d'intérêts des députés","3,752,932","4,160,323","3,752,932","4,160,323","4,304,011"
"OEC","Internal Services","Services internes","2,262,994","2,477,539","2,262,994","2,477,539","2,149,438"
"SWC","Women's participation in Canadian society","Participation des femmes à la société canadienne","22,720,250","21,560,223","22,720,250","21,560,223","22,465,800"
"SWC","Strategic Policy Analysis, Planning and Development","Élaboration, planification et analyse des politiques stratégiques","1,961,238","1,998,592","1,961,238","1,998,592","2,141,397"
"SWC","Internal Services","Services internes","5,560,258","5,876,011","5,560,258","5,876,011","5,120,989"
"OCI","Ombudsman for federal offenders","Ombudsman pour les délinquants","3,240,837","3,715,963","3,240,837","3,715,963","3,514,836"
"OCI","Internal Services","Services internes","837,742","1,220,705","837,742","1,220,705","1,061,550"
"ODPP","Regulatory offences and economic crime prosecution program","Programme de poursuites des infractions aux règlements et des crimes économiques","13,157,166","13,986,904","13,157,166","13,986,904","14,443,793"
"ODPP","Drug, Criminal Code, and terrorism prosecution program","Programme de poursuites des infractions en matière de drogues, au titre du Code criminel et en matière de terrorisme","111,856,195","117,158,894","111,856,195","117,158,894","122,714,750"
"ODPP","Internal Services","Services internes","21,322,446","25,297,853","21,322,446","25,297,853","26,208,280"
"OPSIC","Disclosure and Reprisal Management Program","Programme de gestion des divulgations et des représailles","3,317,796","3,499,031","3,317,796","3,499,031","3,627,994"
"OPSIC","Internal Services","Services internes","2,005,902","2,166,832","2,005,902","2,166,832","1,915,002"
"OSFI","International Assistance","Aide internationale","-131,839",0,"-131,839",0,0
"OSFI","Actuarial Valuation and Advisory Services","Évaluations actuarielles et services conseils","-40,027","-2,629,002","-40,027","-2,629,002","-1,383,716"
"OSFI","Regulation and Supervision of Federally Regulated Financial Institutions","Réglementation et surveillance des institutions financières fédérales","11,040,835","-7,420,715","11,040,835","-7,420,715","1,417,325"
"OSFI","Regulation and Supervision of Federally Regulated Private Pension Plans","Réglementation et surveillance des régimes de retraite privés fédéraux","-3,210,232","-2,532,720","-3,210,232","-2,532,720","-1,811,101"
"OSFI","Internal Services","Services internes","8,088,866","-22,375","8,088,866","-22,375","1,464,756"
"IPC","Compliance Activities","Activités relatives à la conformité","9,568,356","11,572,471","9,568,356","11,572,471","11,800,606"
"IPC","Compliance with access to information obligations","Conformité avec les obligations prévues à la Loi sur l'accès à l'information","8,724,583","8,756,961","8,724,583","8,756,961","9,179,989"
"IPC","Public Outreach","Sensibilisation du grand public","3,297,896","2,985,363","3,297,896","2,985,363","3,500,946"
"IPC","Research and Policy Development","Recherche et élaboration des politiques","3,218,195","3,930,541","3,218,195","3,930,541","4,028,548"
"IPC","Internal services Office of the Privacy Commissioner","Services internes","6,740,092","7,654,492","6,740,092","7,654,492","6,208,756"
"IPC","Internal services Office of the information commissioner","Services internes","3,888,617","3,890,869","3,888,617","3,890,869","3,112,691"
"CLVM","Old Port of Montreal Corporation Inc.","Société du Vieux-Port de Montréal inc.","28,986,795","30,373,000","28,986,795","30,373,000","24,472,000"
"PCA","Heritage Resources Conservation","Conservation des ressources patrimoniales","215,946,599","158,761,481","215,946,599","158,761,481","146,398,626"
"PCA","Heritage Places Establishment","Création de lieux patrimoniaux","21,685,557","14,167,678","21,685,557","14,167,678","14,874,251"
"PCA","Public Appreciation and Understanding","Appréciation et compréhension du public","50,823,245","52,880,244","50,823,245","52,880,244","52,372,807"
"PCA","Visitor Experience","Expérience du visiteur","347,802,564","262,896,567","347,802,564","262,896,567","239,572,389"
"PCA","Townsite and Throughway Infrastructure","Infrastructure des lotissements urbains et routes de transit","162,421,675","104,365,104","162,421,675","104,365,104","91,782,776"
"PCA","Internal Services","Services internes","87,036,010","84,940,832","87,036,010","84,940,832","85,546,742"
"PMPRB","Pharmaceutical Trends Program","Le programme sur les tendances relatives aux produits pharmaceutiques","890,377","1,010,528","890,377","1,010,528","983,279"
"PMPRB","Patented medicine prices regulation program","Le programme de réglementation du prix des médicaments brevetés","4,232,009","7,346,773","4,232,009","7,346,773","3,888,795"
"PMPRB","Internal Services","Services internes","4,348,321","3,397,074","4,348,321","3,397,074","3,184,729"
"PPP","Ppp Canada Inc.","PPP Canada Inc.","253,500,000","287,700,000","253,500,000","287,700,000","287,450,000"
"PCO","Prime Minister and portfolio ministers support and advice","Soutien et conseils au Premier ministre et aux ministres du portefeuille","69,597,828","70,756,910","69,597,828","70,756,910","68,183,596"
"PCO","Public service leadership and direction","Leadership et orientation au sein de la fonction publique","3,968,160","4,579,031","3,968,160","4,579,031","2,673,659"
"PCO","Commissions of inquiry","Commissions d'enquête","13,242,046","11,218,897","13,242,046","11,218,897","2,558,379"
"PCO","Cabinet and Cabinet committees advice and support","Soutien et conseils au Cabinet et aux comités du Cabinet","17,386,432","18,900,020","17,386,432","18,900,020","14,917,947"
"PCO","Internal Services","Services internes","55,736,210","49,974,956","55,736,210","49,974,956","41,898,860"
"PACS","Oversight of the Governor-in-Council appointments","Surveillance des nominations faites par le gouverneur en conseil","243,887","119,620","243,887","119,620",0
"PACS","Internal Services","Services internes","50,247","15,460","50,247","15,460",0
"PHAC","Science and Technology for Public Health","Sciences et technologie pour la santé publique","81,588,264","78,603,948","81,588,264","78,603,948","68,904,693"
"PHAC","Health Promotion","Promotion de la santé","177,434,123","182,593,403","177,434,123","182,593,403","170,303,645"
"PHAC","Regulatory Enforcement and Emergency Response","Exécution de la réglementation et interventions en cas d'urgence","23,229,890","21,669,837","23,229,890","21,669,837","33,667,364"
"PHAC","Surveillance and Population Health Assessment","Surveillance et évaluation de la santé de la population","76,024,471","76,515,100","76,024,471","76,515,100","69,933,545"
"PHAC","Public Health Preparedness and Capacity","État de préparation et capacité en santé publique","60,726,561","66,677,028","60,726,561","66,677,028","78,117,836"
"PHAC","Disease and Injury Prevention and Mitigation","Prévention et réduction des maladies et des blessures","86,282,096","91,322,167","86,282,096","91,322,167","92,245,397"
"PHAC","Internal Services","Services internes","112,834,688","119,118,054","112,834,688","119,118,054","106,483,749"
"PSEP","Policing and Law Enforcement","Application de la loi","252,557,084",0,"252,557,084",0,0
"PSEP","National Security","Sécurité nationale","8,127,830","17,695,636","8,127,830","17,695,636","29,085,820"
"PSEP","Emergency Management","Gestion des mesures d'urgence","142,245,890","143,352,872","142,245,890","143,352,872","325,816,430"
"PSEP","Corrections","Régime correctionnel","8,568,666",0,"8,568,666",0,0
"PSEP","Crime Prevention","Prévention du crime","51,367,228",0,"51,367,228",0,0
"PSEP","Border Strategies","Stratégies frontalières","1,999,257","3,002,105","1,999,257","3,002,105","4,230,514"
"PSEP","Interoperabilit","Interopérabilité","942,827",0,"942,827",0,0
"PSEP","Internal Services","Services internes","66,788,375","67,395,070","66,788,375","67,395,070","64,144,320"
"PSEP","Countering Crime","Lutte au crime",0,"170,119,113",0,"170,119,113","160,996,694"
"PSC","Appointment Integrity and Political Impartiality","Intégrité des nominations et impartialité politique","11,567,143","14,647,191","11,567,143","14,647,191","16,019,847"
"PSC","Staffing Services and Assessment","Services de dotation et d'évaluation","29,182,538","32,010,281","29,182,538","32,010,281","27,590,904"
"PSC","Oversight of Integrity in Staffing","Surveillance de l’intégrité de la dotation","22,245,608","21,547,291","22,245,608","21,547,291","20,000,247"
"PSC","Internal Services","Services internes","37,979,809","37,401,120","37,979,809","37,401,120","32,119,068"
"PSSRB","Adjudication, mediation and compensation analysis and research","Arbitrage, médiation et analyse et recherche en matière de rémunération","8,313,169","9,368,528","8,313,169","9,368,528","9,736,106"
"PSSRB","Internal Services","Services internes","3,575,607","4,078,172","3,575,607","4,078,172","3,898,234"
"PSST","Adjudication and mediation of complaints filed under the Public Service Employment Act","Arbitrage et médiation des plaintes déposées en vertu de la Loi sur l'emploi dans la fonction publique","3,477,183","3,644,333","3,477,183","3,644,333","3,747,033"
"PSST","Internal Services","Services internes","1,269,655","1,291,742","1,269,655","1,291,742","1,361,774"
"GSC","Acquisitions","Approvisionnement","144,282,951","157,777,964","144,282,951","157,777,964","158,849,677"
"GSC","Information Technology Infrastructure Service","Services d'infrastructure et de technologie de l'information","33,653,104","7,744,155","33,653,104","7,744,155",0
"GSC","Federal Pay and Pension Administration","Administration de la paye et des pensions fédérales","46,940,630","67,681,526","46,940,630","67,681,526","80,559,725"
"GSC","Accommodation and Real Property Assets Management","Gestion des locaux et des biens immobiliers","2,216,628,145","1,963,599,900","2,216,628,145","1,963,599,900","2,011,582,718"
"GSC","Receiver General for Canada","Receveur général du Canada","119,876,466","123,141,196","119,876,466","123,141,196","117,792,671"
"GSC","Linguistic Management and Services","Services linguistiques et gestion connexe","74,337,996","74,116,158","74,337,996","74,116,158","78,458,807"
"GSC","Specialized Programs and Services","Programmes et services spécialisés","104,201,802","53,833,109","104,201,802","53,833,109","49,534,679"
"GSC","Procurement Ombudsman","Ombudsman de l'approvisionnement","3,608,650","3,667,301","3,608,650","3,667,301","3,884,382"
"GSC","Internal Services","Services internes","337,037,076","341,947,236","337,037,076","341,947,236","236,870,598"
"CT","Process Cases","Traitement des affaires","874,363","1,019,714","874,363","1,019,714","1,353,452"
"CT","Internal Services","Services internes","651,557","568,982","651,557","568,982","383,360"
"RPSDP","Reprisal Hearings Program","Programme des audiences relatives aux représailles","940,308","1,686,603","940,308","1,686,603","1,659,741"
"RSCT","Registry Services","Services de greffe","1,391,712","1,825,649","1,391,712","1,825,649","1,604,871"
"RSCT","Internal Services","Services internes","773,560","608,627","773,560","608,627","532,742"
"RCMP","Community, Contract and Aboriginal Policing","Services de police communautaires, contractuels et autochtones","703,058,484",0,"703,058,484",0,0
"RCMP","Criminal Intelligence Operations","Programme Réglementation de l'énergie","61,270,934",0,"61,270,934",0,0
"RCMP","Police Operations","Opérations policières","646,231,717","1,667,296,027","646,231,717","1,667,296,027","1,913,573,311"
"RCMP","National Police Services","Services de police nationaux","136,596,259",0,"136,596,259",0,0
"RCMP","Policing Support Services","Services de soutien aux services de police","71,353,512",0,"71,353,512",0,0
"RCMP","Canadian Law Enforcement Services","Services canadiens d'application de la loi","377,072,923","256,203,400","377,072,923","256,203,400","260,304,114"
"RCMP","Technical Policing Operations","Opérations relatives à la police technique","207,049,783",0,"207,049,783",0,0
"RCMP","Survivor Income Plan","Plan de prestation des survivants","2,173,543",0,"2,173,543",0,0
"RCMP","Registration, Licensing and Supporting Infrastructure","Enregistrement des armes à feu","7,309,517",0,"7,309,517",0,0
"RCMP","Policy, Regulatory, Communication and Portfolio Intergration","Délivrance de permis des armes à feu et infrastructure de soutien","50,686,090",0,"50,686,090",0,0
"RCMP","Pensions under the RCMP Continuation Act","Pensions aux termes de la Loi sur la continuation des pensions de la GRC","16,480,442",0,"16,480,442",0,0
